{
  "evaluacion_id": "35_probabilidad_condicional-20260910111137",
  "titulo": "Evaluación 35_probabilidad_condicional",
  "usuario": {
    "nombre": ""
  },
  "preguntas": [
    {
      "id_pregunta": 1,
      "enunciado": "¿Cuál es la fórmula correcta de la probabilidad condicional $P(A|B)$?",
      "opciones": [
        "a) $P(A \\cap B) \\cdot P(B)$",
        "b) $\\frac{P(A \\cap B)}{P(B)}$",
        "c) $\\frac{P(A)}{P(B)}$",
        "d) $P(A \\cup B) - P(B)$"
      ],
      "respuesta_correcta": "b) $\\frac{P(A \\cap B)}{P(B)}$",
      "respuesta_usuario": "b) $\\frac{P(A \\cap B)}{P(B)}$",
      "es_correcta": true
    },
    {
      "id_pregunta": 2,
      "enunciado": "Si $P(A \\cap B) = 0.2$ y $P(B) = 0.5$, ¿cuál es $P(A|B)$?",
      "opciones": [
        "a) 0.10",
        "b) 0.25",
        "c) 0.40",
        "d) 1.00"
      ],
      "respuesta_correcta": "c) 0.40",
      "respuesta_usuario": "c) 0.40",
      "es_correcta": true
    },
    {
      "id_pregunta": 3,
      "enunciado": "Según la regla del producto, ¿cuál de las siguientes expresiones es igual a $P(A \\cap B)$?",
      "opciones": [
        "a) $P(A|B) \\cdot P(A)$",
        "b) $P(B|A) \\cdot P(A)$",
        "c) $P(A) + P(B)$",
        "d) $P(A|B) + P(B|A)$"
      ],
      "respuesta_correcta": "b) $P(B|A) \\cdot P(A)$",
      "respuesta_usuario": "b) $P(B|A) \\cdot P(A)$",
      "es_correcta": true
    },
    {
      "id_pregunta": 4,
      "enunciado": "Al condicionar por un evento $B$ con $P(B) > 0$, ¿qué ocurre con el espacio muestral?",
      "opciones": [
        "a) Se mantiene intacto y no cambia",
        "b) Se reduce al evento $B$",
        "c) Se amplía para incluir eventos adicionales",
        "d) Se convierte en el evento complementario de $B$"
      ],
      "respuesta_correcta": "b) Se reduce al evento $B$",
      "respuesta_usuario": "d) Se convierte en el evento complementario de $B$",
      "es_correcta": false
    },
    {
      "id_pregunta": 5,
      "enunciado": "Si $P(B) = 0$, ¿qué sucede con la probabilidad condicional $P(A|B)$?",
      "opciones": [
        "a) Vale 0",
        "b) Vale $P(A)$",
        "c) No está definida",
        "d) Vale 1"
      ],
      "respuesta_correcta": "c) No está definida",
      "respuesta_usuario": "b) Vale $P(A)$",
      "es_correcta": false
    },
    {
      "id_pregunta": 6,
      "enunciado": "En un dado de seis caras, sean $A = \\{2\\}$ y $B = \\{1, 2, 3\\}$. ¿Cuál es $P(A|B)$?",
      "opciones": [
        "a) $\\frac{1}{6}$",
        "b) $\\frac{1}{3}$",
        "c) $\\frac{1}{2}$",
        "d) $\\frac{2}{3}$"
      ],
      "respuesta_correcta": "b) $\\frac{1}{3}$",
      "respuesta_usuario": "b) $\\frac{1}{3}$",
      "es_correcta": true
    },
    {
      "id_pregunta": 7,
      "enunciado": "Una fábrica recibe piezas de dos proveedores: el Proveedor 1 ($60\\%$ de las piezas, $5\\%$ defectuosas) y el Proveedor 2 ($40\\%$ de las piezas, $3\\%$ defectuosas). ¿Cuál es la probabilidad total de defecto $P(D)$?",
      "opciones": [
        "a) 0.080",
        "b) 0.042",
        "c) 0.040",
        "d) 0.035"
      ],
      "respuesta_correcta": "b) 0.042",
      "respuesta_usuario": "c) 0.040",
      "es_correcta": false
    },
    {
      "id_pregunta": 8,
      "enunciado": "¿Para qué sirve el Teorema de Bayes?",
      "opciones": [
        "a) Para calcular la intersección de dos eventos independientes",
        "b) Para invertir el condicionamiento: obtener $P(B|A)$ a partir de $P(A|B)$",
        "c) Para determinar si dos eventos son mutuamente excluyentes",
        "d) Para calcular la unión de múltiples eventos"
      ],
      "respuesta_correcta": "b) Para invertir el condicionamiento: obtener $P(B|A)$ a partir de $P(A|B)$",
      "respuesta_usuario": "b) Para invertir el condicionamiento: obtener $P(B|A)$ a partir de $P(A|B)$",
      "es_correcta": true
    },
    {
      "id_pregunta": 9,
      "enunciado": "Si $P(A \\cap B) = \\frac{3}{8}$ y $P(B) = \\frac{1}{2}$, ¿cuál es $P(A|B)$?",
      "opciones": [
        "a) $\\frac{3}{16}$",
        "b) $\\frac{3}{4}$",
        "c) $\\frac{1}{4}$",
        "d) $\\frac{1}{8}$"
      ],
      "respuesta_correcta": "b) $\\frac{3}{4}$",
      "respuesta_usuario": "d) $\\frac{1}{8}$",
      "es_correcta": false
    },
    {
      "id_pregunta": 10,
      "enunciado": "En el ejemplo de prueba diagnóstica del material, la probabilidad de enfermedad dado un resultado positivo es solo ~51.35% a pesar de que la sensibilidad es 95%. ¿Cuál es la razón principal?",
      "opciones": [
        "a) La sensibilidad de la prueba es demasiado baja",
        "b) La baja prevalencia de la enfermedad en la población",
        "c) La especificidad de la prueba es del 100%",
        "d) La fórmula de probabilidad condicional no se aplica en medicina"
      ],
      "respuesta_correcta": "b) La baja prevalencia de la enfermedad en la población",
      "respuesta_usuario": "b) La baja prevalencia de la enfermedad en la población",
      "es_correcta": true
    }
  ],
  "resultado_final": {
    "calificacion": 60.0,
    "total_correctas": 6,
    "total_preguntas": 10
  }
}