{
  "evaluacion_id": "16_relaciones-20260909084701",
  "titulo": "Evaluación 16_relaciones",
  "usuario": {
    "nombre": ""
  },
  "preguntas": [
    {
      "id_pregunta": 1,
      "enunciado": "¿Qué es una relación binaria $R$ entre los conjuntos $A$ y $B$?",
      "opciones": [
        "a) Una función que asigna cada elemento de $A$ a un solo elemento de $B$",
        "b) Un subconjunto del producto cartesiano $A \\times B$",
        "c) El conjunto de todos los elementos de $A$ que no tienen imagen en $B$",
        "d) Una matriz cuadrada de dimensión $|A| \\times |B|$"
      ],
      "respuesta_correcta": "b) Un subconjunto del producto cartesiano $A \\times B$",
      "respuesta_usuario": "b) Un subconjunto del producto cartesiano $A \\times B$",
      "es_correcta": true
    },
    {
      "id_pregunta": 2,
      "enunciado": "Si $A = \\{3, 7\\}$ y $B = \\{2, 8\\}$, ¿pertenecen los pares $(3, 8)$ y $(7, 2)$ al producto cartesiano $A \\times B$?",
      "opciones": [
        "a) Ninguno pertenece",
        "b) Solo $(7, 2)$ pertenece",
        "c) Solo $(3, 8)$ pertenece",
        "d) Ambos pertenecen"
      ],
      "respuesta_correcta": "d) Ambos pertenecen",
      "respuesta_usuario": "d) Ambos pertenecen",
      "es_correcta": true
    },
    {
      "id_pregunta": 3,
      "enunciado": "Sean $A = \\{1, 2, 3\\}$ y $B = \\{4, 5\\}$ con la relación $R = \\{(1,4), (1,5), (2,4)\\}$. ¿Cuál es el dominio de $R$?",
      "opciones": [
        "a) $\\{4, 5\\}$",
        "b) $\\{1, 2, 3\\}$",
        "c) $\\{1, 2\\}$",
        "d) $\\{3, 4, 5\\}$"
      ],
      "respuesta_correcta": "c) $\\{1, 2\\}$",
      "respuesta_usuario": "c) $\\{1, 2\\}$",
      "es_correcta": true
    },
    {
      "id_pregunta": 4,
      "enunciado": "En una tienda en línea, la relación \"$a$ envía al distrito $b$\" vincula las zonas de despacho $A = \\{X, Y, Z\\}$ con los distritos $B = \\{d_1, d_2, d_3\\}$. Si el rango de la relación es $\\{d_1, d_3\\}$, ¿qué significa?",
      "opciones": [
        "a) Ningún distrito recibe pedidos",
        "b) Solo los distritos $d_1$ y $d_3$ reciben al menos un envío",
        "c) Todos los distritos reciben pedidos",
        "d) Solo la zona $Y$ realiza envíos"
      ],
      "respuesta_correcta": "b) Solo los distritos $d_1$ y $d_3$ reciben al menos un envío",
      "respuesta_usuario": "b) Solo los distritos $d_1$ y $d_3$ reciben al menos un envío",
      "es_correcta": true
    },
    {
      "id_pregunta": 5,
      "enunciado": "¿Cuál es la dimensión de la matriz de una relación $R$ entre $A = \\{p, q, r\\}$ y $B = \\{s, t\\}$?",
      "opciones": [
        "a) $2 \\times 3$",
        "b) $3 \\times 3$",
        "c) $3 \\times 2$",
        "d) $2 \\times 2$"
      ],
      "respuesta_correcta": "c) $3 \\times 2$",
      "respuesta_usuario": "c) $3 \\times 2$",
      "es_correcta": true
    },
    {
      "id_pregunta": 6,
      "enunciado": "La matriz de la relación $R$ entre $A = \\{a, b, c\\}$ y $B = \\{x, y\\}$ es:\n\nM = [[1, 0], [0, 1], [1, 1]]  (filas: a, b, c; columnas: x, y)\n\n¿Cuántos pares contiene $R$?",
      "opciones": [
        "a) 4",
        "b) 3",
        "c) 6",
        "d) 2"
      ],
      "respuesta_correcta": "a) 4",
      "respuesta_usuario": "a) 4",
      "es_correcta": true
    },
    {
      "id_pregunta": 7,
      "enunciado": "Si el elemento $c \\in A$ tiene dos flechas salientes en el diagrama sagital (una hacia $x$ y otra hacia $y$), ¿qué puede afirmarse?",
      "opciones": [
        "a) La relación es necesariamente una función",
        "b) La relación no puede ser una función",
        "c) La relación no tiene dominio",
        "d) La relación está vacía"
      ],
      "respuesta_correcta": "b) La relación no puede ser una función",
      "respuesta_usuario": "b) La relación no puede ser una función",
      "es_correcta": true
    },
    {
      "id_pregunta": 8,
      "enunciado": "Si $A = \\{u, v\\}$ y $B = \\{m, n, p\\}$, ¿cuántos pares forman el producto cartesiano $A \\times B$?",
      "opciones": [
        "a) 5",
        "b) 3",
        "c) 6",
        "d) 9"
      ],
      "respuesta_correcta": "c) 6",
      "respuesta_usuario": "c) 6",
      "es_correcta": true
    },
    {
      "id_pregunta": 9,
      "enunciado": "En un gimnasio, la relación \"$a$ ofrece el servicio $b$\" relaciona los paquetes $A = \\{Básico, Premium\\}$ con los servicios $B = \\{Spa, Yoga, Box\\}$, con $R = \\{(Básico, Spa), (Premium, Yoga), (Premium, Box)\\}$. ¿Es $R$ una función?",
      "opciones": [
        "a) No, porque el elemento $Básico$ tiene dos flechas salientes",
        "b) No, porque el servicio $Spa$ recibe solo una flecha",
        "c) Sí, porque cada paquete tiene al menos una salida",
        "d) No, porque $Premium$ tiene dos flechas salientes"
      ],
      "respuesta_correcta": "d) No, porque $Premium$ tiene dos flechas salientes",
      "respuesta_usuario": "d) No, porque $Premium$ tiene dos flechas salientes",
      "es_correcta": true
    },
    {
      "id_pregunta": 10,
      "enunciado": "Para $A = \\{1, 2\\}$, $B = \\{3, 4\\}$ y $R = \\{(1,3), (2,3), (2,4)\\}$, ¿cuál es la matriz de la relación?",
      "opciones": [
        "a) [[1, 1], [1, 0]]",
        "b) [[1, 0], [1, 1]]",
        "c) [[0, 1], [1, 1]]",
        "d) [[1, 0], [0, 1]]"
      ],
      "respuesta_correcta": "b) [[1, 0], [1, 1]]",
      "respuesta_usuario": "b) [[1, 0], [1, 1]]",
      "es_correcta": true
    }
  ],
  "resultado_final": {
    "calificacion": 100.0,
    "total_correctas": 10,
    "total_preguntas": 10
  }
}