{
  "evaluacion_id": "31_ejercicios_analisis_combinatorio-20260910101121",
  "titulo": "Evaluación 31_ejercicios_analisis_combinatorio",
  "usuario": {
    "nombre": ""
  },
  "preguntas": [
    {
      "id_pregunta": 1,
      "enunciado": "¿Cuántas contraseñas de 4 caracteres se pueden crear con 26 letras (sin distinción mayúsculas/minúsculas) si las letras pueden repetirse?",
      "opciones": [
        "a) $26 \\times 25 \\times 24 \\times 23$",
        "b) $26^4 = 456\\,976$",
        "c) $26 \\times 4 = 104$",
        "d) $4^{26}$"
      ],
      "respuesta_correcta": "b) $26^4 = 456\\,976$",
      "respuesta_usuario": "b) $26^4 = 456\\,976$",
      "es_correcta": true
    },
    {
      "id_pregunta": 2,
      "enunciado": "De 8 personas, ¿cuántas comisiones de 3 se pueden formar si el orden de selección no importa?",
      "opciones": [
        "a) $P(8,3) = 336$",
        "b) $C(8,3) = 56$",
        "c) $8^3 = 512$",
        "d) $8 \\times 3 = 24$"
      ],
      "respuesta_correcta": "b) $C(8,3) = 56$",
      "respuesta_usuario": "c) $8^3 = 512$",
      "es_correcta": false
    },
    {
      "id_pregunta": 3,
      "enunciado": "Calcule $5!$:",
      "opciones": [
        "a) $125$",
        "b) $60$",
        "c) $120$",
        "d) $25$"
      ],
      "respuesta_correcta": "c) $120$",
      "respuesta_usuario": "a) $125$",
      "es_correcta": false
    },
    {
      "id_pregunta": 4,
      "enunciado": "De 10 colores disponibles, ¿de cuántas formas se pueden pintar 3 franjas en una bandera si no se permite repetir colores y el orden importa?",
      "opciones": [
        "a) $C(10,3) = 120$",
        "b) $10^3 = 1000$",
        "c) $P(10,3) = 720$",
        "d) $10 \\times 3 = 30$"
      ],
      "respuesta_correcta": "c) $P(10,3) = 720$",
      "respuesta_usuario": "d) $10 \\times 3 = 30$",
      "es_correcta": false
    },
    {
      "id_pregunta": 5,
      "enunciado": "¿Cuántas formas hay de elegir 4 libros de entre 7 disponibles, sin importar el orden?",
      "opciones": [
        "a) $P(7,4) = 840$",
        "b) $7^4 = 2\\,401$",
        "c) $\\binom{7}{4} = 35$",
        "d) $7 \\times 4 = 28$"
      ],
      "respuesta_correcta": "c) $\\binom{7}{4} = 35$",
      "respuesta_usuario": "c) $\\binom{7}{4} = 35$",
      "es_correcta": true
    },
    {
      "id_pregunta": 6,
      "enunciado": "Un menú ofrece 4 entradas, 5 platos principales y 3 postres. ¿Cuántos menús completos (un ítem de cada categoría) se pueden armar?",
      "opciones": [
        "a) $4 + 5 + 3 = 12$",
        "b) $C(12,3) = 220$",
        "c) $P(12,3) = 1\\,320$",
        "d) $4 \\times 5 \\times 3 = 60$"
      ],
      "respuesta_correcta": "d) $4 \\times 5 \\times 3 = 60$",
      "respuesta_usuario": "b) $C(12,3) = 220$",
      "es_correcta": false
    },
    {
      "id_pregunta": 7,
      "enunciado": "¿Cuántas palabras de 5 letras se pueden formar con las letras A, B, C, D y E usando cada letra exactamente una vez?",
      "opciones": [
        "a) $5^5 = 3\\,125$",
        "b) $C(5,5) = 1$",
        "c) $5! = 120$",
        "d) $P(5,2) = 20$"
      ],
      "respuesta_correcta": "c) $5! = 120$",
      "respuesta_usuario": "b) $C(5,5) = 1$",
      "es_correcta": false
    },
    {
      "id_pregunta": 8,
      "enunciado": "En una mesa redonda con 6 asientos, ¿cuántas formas hay de sentar 6 personas si dos disposiciones que difieren solo por una rotación se consideran iguales?",
      "opciones": [
        "a) $6! = 720$",
        "b) $5! = 120$",
        "c) $C(6,6) = 1$",
        "d) $6 \\times 5 = 30$"
      ],
      "respuesta_correcta": "b) $5! = 120$",
      "respuesta_usuario": "b) $5! = 120$",
      "es_correcta": true
    },
    {
      "id_pregunta": 9,
      "enunciado": "Se tienen 3 tipos de bebidas y un cliente puede llevar cuántas quiera de cada una (incluyendo cero) hasta completar un paquete de 4. ¿Cuántas formas hay de elegir el paquete?",
      "opciones": [
        "a) $3^4 = 81$",
        "b) $P(3,4)$ no está definido",
        "c) $\\binom{6}{4} = 15$",
        "d) $\\binom{3+4-1}{4} = \\binom{6}{4} = 15$"
      ],
      "respuesta_correcta": "d) $\\binom{3+4-1}{4} = \\binom{6}{4} = 15$",
      "respuesta_usuario": "d) $\\binom{3+4-1}{4} = \\binom{6}{4} = 15$",
      "es_correcta": true
    },
    {
      "id_pregunta": 10,
      "enunciado": "De un grupo de 6 personas, se quiere elegir un presidente y un secretario (la persona no puede ocupar ambos cargos). ¿Cuántas formas hay?",
      "opciones": [
        "a) $C(6,2) = 15$",
        "b) $6^2 = 36$",
        "c) $P(6,2) = 30$",
        "d) $6 \\times 2 = 12$"
      ],
      "respuesta_correcta": "c) $P(6,2) = 30$",
      "respuesta_usuario": "a) $C(6,2) = 15$",
      "es_correcta": false
    }
  ],
  "resultado_final": {
    "calificacion": 40.0,
    "total_correctas": 4,
    "total_preguntas": 10
  }
}