{
  "evaluacion_id": "02_subconjuntos-20260908100814",
  "titulo": "Evaluación 02_subconjuntos",
  "usuario": {
    "nombre": ""
  },
  "preguntas": [
    {
      "id_pregunta": 1,
      "enunciado": "¿Cuál es la definición formal de que $A$ sea subconjunto de $B$ ($A \\subseteq B$)?",
      "opciones": [
        "a) Que $A$ y $B$ tengan exactamente los mismos elementos",
        "b) Que cada elemento de $A$ también pertenezca a $B$",
        "c) Que cada elemento de $B$ también pertenezca a $A$",
        "d) Que $A$ tenga más elementos que $B$"
      ],
      "respuesta_correcta": "b) Que cada elemento de $A$ también pertenezca a $B$",
      "respuesta_usuario": "b) Que cada elemento de $A$ también pertenezca a $B$",
      "es_correcta": true
    },
    {
      "id_pregunta": 2,
      "enunciado": "La propiedad reflexiva de la contención establece que:",
      "opciones": [
        "a) Si $A \\subseteq B$ y $B \\subseteq C$, entonces $A \\subseteq C$",
        "b) Todo conjunto está contenido en sí mismo: $A \\subseteq A$",
        "c) Si $A \\subseteq B$ y $B \\subseteq A$, entonces $A = B$",
        "d) El conjunto vacío pertenece a todo conjunto"
      ],
      "respuesta_correcta": "b) Todo conjunto está contenido en sí mismo: $A \\subseteq A$",
      "respuesta_usuario": "b) Todo conjunto está contenido en sí mismo: $A \\subseteq A$",
      "es_correcta": true
    },
    {
      "id_pregunta": 3,
      "enunciado": "La propiedad transitiva de la contención establece que:",
      "opciones": [
        "a) $A \\subseteq A$ para todo conjunto $A$",
        "b) Si $A \\subseteq B$ y $B \\subseteq A$, entonces $A = B$",
        "c) Si $A \\subseteq B$ y $B \\subseteq C$, entonces $A \\subseteq C$",
        "d) $\\emptyset \\subseteq A$ para cualquier conjunto $A$"
      ],
      "respuesta_correcta": "c) Si $A \\subseteq B$ y $B \\subseteq C$, entonces $A \\subseteq C$",
      "respuesta_usuario": "c) Si $A \\subseteq B$ y $B \\subseteq C$, entonces $A \\subseteq C$",
      "es_correcta": true
    },
    {
      "id_pregunta": 4,
      "enunciado": "La propiedad antisimétrica de la contención establece que:",
      "opciones": [
        "a) Si $A \\subseteq B$ y $B \\subseteq A$, entonces $A = B$",
        "b) Todo conjunto está contenido en sí mismo",
        "c) $\\emptyset \\subseteq A$",
        "d) $A \\subseteq \\Omega$"
      ],
      "respuesta_correcta": "a) Si $A \\subseteq B$ y $B \\subseteq A$, entonces $A = B$",
      "respuesta_usuario": "a) Si $A \\subseteq B$ y $B \\subseteq A$, entonces $A = B$",
      "es_correcta": true
    },
    {
      "id_pregunta": 5,
      "enunciado": "¿Cuándo se dice que $A$ no es subconjunto de $B$ ($A \\nsubseteq B$)?",
      "opciones": [
        "a) Cuando $A$ y $B$ son exactamente iguales",
        "b) Cuando $A$ tiene menos elementos que $B$",
        "c) Cuando existe al menos un elemento de $A$ que no pertenece a $B$",
        "d) Cuando $B$ está contenido en $A$"
      ],
      "respuesta_correcta": "c) Cuando existe al menos un elemento de $A$ que no pertenece a $B$",
      "respuesta_usuario": "c) Cuando existe al menos un elemento de $A$ que no pertenece a $B$",
      "es_correcta": true
    },
    {
      "id_pregunta": 6,
      "enunciado": "En el ejemplo del dataset de matrimonios, $B$ = matrimonios `bachelors` con terapia prematrimonial y $A$ = matrimonios `bachelors`. Se cumple que:",
      "opciones": [
        "a) $A \\subseteq B$",
        "b) $B \\subseteq A$",
        "c) $A \\cap B = \\emptyset$",
        "d) $B = \\Omega$"
      ],
      "respuesta_correcta": "b) $B \\subseteq A$",
      "respuesta_usuario": "b) $B \\subseteq A$",
      "es_correcta": true
    },
    {
      "id_pregunta": 7,
      "enunciado": "Si $B \\subseteq A$, la probabilidad condicional $P(B \\mid A)$ se calcula como:",
      "opciones": [
        "a) $P(B \\mid A) = \\frac{|A|}{|B|}$",
        "b) $P(B \\mid A) = \\frac{|B|}{|A|}$",
        "c) $P(B \\mid A) = \\frac{|B|}{|\\Omega|}$",
        "d) $P(B \\mid A) = \\frac{|A|}{|\\Omega|}$"
      ],
      "respuesta_correcta": "b) $P(B \\mid A) = \\frac{|B|}{|A|}$",
      "respuesta_usuario": "a) $P(B \\mid A) = \\frac{|A|}{|B|}$",
      "es_correcta": false
    },
    {
      "id_pregunta": 8,
      "enunciado": "Si $B \\subseteq A$, entonces la intersección y la unión verifican:",
      "opciones": [
        "a) $A \\cap B = A$ y $A \\cup B = B$",
        "b) $A \\cap B = B$ y $A \\cup B = A$",
        "c) $A \\cap B = \\emptyset$ y $A \\cup B = \\Omega$",
        "d) $A \\cap B = \\Omega$ y $A \\cup B = \\emptyset$"
      ],
      "respuesta_correcta": "b) $A \\cap B = B$ y $A \\cup B = A$",
      "respuesta_usuario": "a) $A \\cap B = A$ y $A \\cup B = B$",
      "es_correcta": false
    },
    {
      "id_pregunta": 9,
      "enunciado": "Un subconjunto propio $A \\subset B$ cumple que:",
      "opciones": [
        "a) $A = B$",
        "b) $A \\subseteq B$ y $A \\neq B$",
        "c) $B \\subseteq A$ y $A \\neq B$",
        "d) $A \\cap B = \\emptyset$"
      ],
      "respuesta_correcta": "b) $A \\subseteq B$ y $A \\neq B$",
      "respuesta_usuario": "b) $A \\subseteq B$ y $A \\neq B$",
      "es_correcta": true
    },
    {
      "id_pregunta": 10,
      "enunciado": "Si $P(A) \\leq P(B)$ se cumple siempre que:",
      "opciones": [
        "a) $B \\subseteq A$",
        "b) $A \\subseteq B$",
        "c) $A \\cap B = \\emptyset$",
        "d) $A = \\Omega$"
      ],
      "respuesta_correcta": "b) $A \\subseteq B$",
      "respuesta_usuario": "b) $A \\subseteq B$",
      "es_correcta": true
    }
  ],
  "resultado_final": {
    "calificacion": 80.0,
    "total_correctas": 8,
    "total_preguntas": 10
  }
}